{
	"$schema": "./registry.schema.json",
	"champion": "opencode/muse-spark-1.3-contributor-free",
	"updatedAt": "2026-09-25T00:00:00Z",
	"notes": "Known-good registry. Discovery may propose additions in discovery.json but must never rewrite this file automatically; promotion requires executable benchmark evidence via score.mjs.",
	"candidates": [
		{
			"id": "opencode/muse-spark-1.3-contributor-free",
			"provider": "opencode",
			"status": "champion",
			"freeEvidence": {
				"source": "models.dev catalog + provider metadata (price USD 0 per 1M tokens, input and output)",
				"price": 0,
				"priceCurrency": "USD",
				"checkedAt": "2026-09-25T00:00:00Z"
			},
			"health": {
				"status": "unknown",
				"lastChecked": "2026-09-25T00:00:00Z",
				"note": "Catalog presence does not prove health; health is established only by executable benchmark runs."
			},
			"capabilities": [
				"code-review",
				"typescript",
				"javascript",
				"php",
				"wordpress",
				"react",
				"github-actions",
				"refactoring",
				"bugfix",
				"security",
				"tests",
				"documentation"
			]
		}
	]
}
